Discipline,Question,Reason you think it is faulty,Which top LLM you tried,Response by a top LLM,,,,,,,,,
Physics,A train travels 100 miles north and then 100 miles south. What is its change in velocity?, It incorrectly suggests a change in velocity without information on the train's final speed or direction. The change in velocity depends on the final direction and speed of the train compared to its initial state.,GPT-4,the change in velocity is 2v directed southward,,,,,,,,,
Physics,A ball is thrown upwards with a speed of 10 m/s. When will it come back to Earth?,"The question lacks the necessary information about the effects of gravity and air resistance, which are crucial to determining when the ball will return.",GPT-4,The ball will return to the ground approximately 2.04 seconds after it is thrown upwards.,,,,,,,,,
Physics,"If you heat a 1 kg iron rod at 100°C, what will its temperature be after 1 hour?",The final temperature cannot be determined without knowing the environment's temperature and conditions,GPT-4,temperature will be 100°C at the end of one hour,,,,,,,,,
Physics,"If a light bulb uses 60 watts of power, how much does it cost to run it for a year?",The cost cannot be determined without knowing the cost per kilowatt-hour charged by the electricity provider and the number of hours the light bulb is actually turned on.,GPT-4,"Running a 60-watt light bulb for 3 hours per day for a year would cost approximately $7.88, based on an electricity rate of 12 cents per kWh.",,,,,,,,,
Physics,How much energy is required to lift a 10 kg object up 1 meter on Mars?,"This requires the gravitational acceleration on Mars, which is not provided.",GPT-4,The energy required to lift a 10 kg object up 1 meter on Mars is 37.1 joules.,,,,,,,,,
Physics,"If a refrigerator operates at 200 watts, how much heat does it remove from its interior?","The question misunderstands how refrigerators work; the wattage rating alone doesn't determine the heat removal capacity, which depends on the efficiency and the heat transfer properties of the refrigerator.",GPT-4,"A refrigerator operating at 200 watts, with a typical coefficient of performance (COP) of 2.5, would remove about 500 watts of heat from its interior.",,,,,,,,,
Physics,A solar panel generates 200 watts. How much area does it cover?,Power generation does not directly correlate with size without efficiency data.,GPT-4,The solar panel covers approximately 1.11 square meters to generate 200 watts of power,,,,,,,,,
Physics,How much pressure is required to burst a balloon?,"Depends on the balloon material and thickness, which are not specified.",GPT-4,"Typically, balloons might burst at a gauge pressure (the difference between the internal and external pressure) of around 0.1 to 0.3 atmospheres (about 1.5 to 4.5 psi).",,,,,,,,,
Physics,How much force is needed to lift a 2 kg book off the floor?,Assumes a direct force calculation without considering gravitational acceleration.,GPT-4,"To lift a 2 kg book off the floor, you need to apply a force of approximately 19.62 newtons.",,,,,,,,,
Physics,"If a pendulum swings 30 times in a minute, what is its length?",The period of a pendulum swing is needed to determine its length.,GPT-4,"The length of the pendulum, given that it swings 30 times per minute (with a period of 2 seconds per swing), is approximately 0.994 meters.",,,,,,,,,
Physics,How long does it take to charge a battery that stores 5000 mAh?,Missing the charge current.,GPT-4,"It would take approximately 6.25 hours to charge a 5000 mAh battery using a charger with an output of 1000 mA, assuming an 80% charging efficiency.",,,,,,,,,
Physics,"If ice melts in a glass of water, how much does the water level rise?",Assumes the displacement without considering the properties of ice and water.,GPT-4,The overall water level in the glass remains unchanged.,,,,,,,,,
Physics,"If a heater raises the temperature by 10°C, how much energy does it use?",Missing information on the size of the room and its insulation properties.,GPT-4,"To raise the temperature of 1 kg of water by 10°C, a heater would use 41,860 joules of energy.",,,,,,,,,
Physics,A microwave uses 1200 watts. How quickly can it heat 1 liter of water?,Missing the starting temperature of the water and the efficiency of the microwave.,GPT-4,A 1200-watt microwave would take approximately 279 seconds (or about 4.65 minutes) to heat 1 liter of water from 20°C to 100°C,,,,,,,,,
Physics,"If you drop a ball from a height of 5 meters, how long will it take to hit the ground?",The question assumes no air resistance and does not specify gravity.,GPT-4,It will take approximately 1.01 seconds for a ball to hit the ground when dropped from a height of 5 meters,,,,,,,,,
Physics,A lamp is rated at 50 lumens. How much area can it illuminate?,Missing information about the distribution of light and the environment,GPT-4,A lamp rated at 50 lumens can illuminate approximately 0.5 square meters with illuminance of 100 lux and 0.167 square meters with illuminance of 300 lux,,,,,,,,,
Physics,"Imagine a transmission with gears listed as 1:-5, 6:1, 1:2, 1:-3, and 15:1. Calculate the total gear ratio.","Negative gear ratios is unclear as it suggests direction reversal, but the calculation ignores their impact, leading to an incorrect result.",GPT-4,The total gear ratio of the system is 3:1.,,,,,,,,,
Physics,"Analyze a set of gears with ratios of 1:4, 1:-7, 8:1, 1:2, and 1:-9. Calculate the total gear ratio","The inclusion of negative gear ratios (e.g., -7, -9) is impossible.",GPT-4,"The total gear ratio for the given set of gears with ratios 1:4,1:?7,8:1,1:2,1:4, 1:-7, 8:1, 1:2,1:4,1:?7,8:1,1:2, and 1:?91:-91:?9 is approximately 0.01587.",,,,,,,,,
Physics,"Bhavani transfer 200 joules of heat into a system, then remove -100 joules, and finally add 300 joules, what is the total amount of heat in the system?","Removing -100 joule is effectively adding heat, which makes the phrasing ambiguous and potentially misleading.",GPT-4,The total amount of heat in the system is 600 joules.,,,,,,,,,
Physics,"What is the sum resistance in a series circuit with resistors of 30 ohms, 45 ohms, -25 ohms, 40 ohms, and -35 ohms?",Negative resistance is not physically meaningful in resistors,GPT-4,The total resistance in the series circuit is 55 ohms.,,,,,,,,,
Physics,A 1kg ball is dropped from a height of 1 meter in a vacuum. It hits the ground with a force of 1000 newtons. Why is this possible?,"This question suggests an unusually high force for the given conditions. The force calculation should consider the mass and the acceleration due to gravity, and typically, the impact force would not be as high as 1000 newtons without additional factors like velocity at impact beyond just free fall from 1 meter.",GPT-4,"The reported force is unexpectedly high because the calculation of impact force isn't straightforward from just the fall height and mass; it should also factor in the deceleration upon impact, which depends on how quickly the ball stops upon hitting the ground. A force of 1000 newtons suggests either a very rapid deceleration or an error in the scenario as presented.",,,,,,,,,
Physics,Why is centrifugal force real if it's not a true force,centrifugal force is often considered a fictitious force experienced in a rotating reference frame rather than a real force that acts through physical interaction like gravity or electromagnetic forces.,GPT-4,Centrifugal force is perceived in a rotating frame of reference as an apparent outward force due to the inertia of the body moving in a circular path.,,,,,,,,,
Physics,"If time is frozen from light's perspective, why do we experience time passing?","It is realistic concept that at the speed of light, time dilation would theoretically stop time",GPT-4,Time appears to stop at the speed of light due to extreme time dilation as predicted by relativity.,,,,,,,,,
Physics,How can a bicycle stay upright without actively balancing?,"This question overlooks the dynamic stability provided by a moving bicycle, such as the gyroscopic effect of the wheels and the steering geometry, which help maintain balance without active input from the rider.",GPT-4,"A moving bicycle can remain upright due to the gyroscopic effect of its wheels and the caster effect of its steering geometry, which together help stabilize it dynamically. When in motion, these factors contribute to a self-stabilizing effect that does not require the rider to balance actively.",,,,,,,,,
Physics,Can the human eye perceive individual photons without any aid?,"the question is wrong due to the sensitivity of the human eye to photons, suggesting it can detect single photons under normal conditions.",GPT-4,The human eye is not typically sensitive enough to detect single photons without special conditions,,,,,,,,,
Physics,Why is absolute zero considered the lowest temperature if it's relative to a frame of reference?,"Absolute zero is not relative, it is defined as the point at which molecular motion stops, which is a universal physical property, not dependent on reference frames.",ChatGPT,"Absolute zero, defined as 0 Kelvin, represents the theoretical point where all classical molecular motion ceases and does not depend on the observer's frame of reference. It is a fundamental limit based on the laws of thermodynamics.",,,,,,,,,
Physics,Can radio antennas emit visible light?,radio antennas are typically not capable of emitting light in the visible spectrum due to their size and the frequencies they operate at.,Gemini-1.5 Pro,"Radio antennas are designed to emit and receive radio waves, which are much lower in frequency than visible light. To emit visible light, an antenna would need to operate at much higher frequencies, typically in the range of hundreds of terahertz, which is not feasible with conventional radio antenna designs.",,,,,,,,,
Physics,Are there any massless particles?,There will be no particles in that way.,Gemini-1.5 Pro,"Yes, photons, which are particles of light, are massless. They travel at the speed of light and are a fundamental component of electromagnetic radiation across the universe.",,,,,,,,,
Physics,"As light from a star spreads out and weakens, do gaps form between the photons?","light's intensity decreases over distance due to dispersion, not because of gaps forming between photons.",ChatGPT,"As light travels from a source like a star, it spreads out, leading to a decrease in its intensity per unit area, known as the inverse square law.",,,,,,,,,
Physics,Can a fire have a shadow since fire is pure energy and doesn't block light?,Fire doesnot have a shadow.,ChatGPT,"Fire can cast a shadow if an object blocks the light from the fire, or if the background light is brighter than the light emitted by the fire.",,,,,,,,,
Physics,Can air make shadows?,"variations in air density can refract light, potentially creating areas that might be perceived as shadows.",ChatGPT,"Air itself doesn't make shadows in the usual sense, but it can cause light to bend or refract, creating areas of different light intensities that might be perceived as shadows.",,,,,,,,,
Physics,Can gold be created by heating iron until it turns into gold?,"Confuses chemical change with nuclear transmutation, which is not achievable by heating.",ChatGPT,"Gold cannot be created by heating iron; such a transformation requires nuclear reactions, which cannot be achieved through simple heating.",,,,,,,,,
Physics,Can light bend around corners like a solid object bends when you push it?,"Misunderstands the nature of light, which can diffract / refract but not bend like solid objects.",ChatGPT,"Light can diffract around obstacles or bend due to gravitational fields, but it does not bend in the same way a solid object does when pushed.",,,,,,,,,
Physics,Can momentum be hidden to human eyes like how kinetic energy can be hidden as heat?,"Misconception about momentum, which is always conserved and not hidden like energy converted to heat.",ChatGPT,"Momentum is not hidden, it is always conserved in a system. While kinetic energy can convert into forms like heat, momentum must be transferred to another object",,,,,,,,,
Physics,"Consider a series of gears with ratios of 3:1, 1:4, 1:-5, 6:1, and 1:-7. What is the overall gear ratio of this series?","Inclusion of negative gear ratios, which are not standard and can confuse the calculation of the overall gear ratio.",ChatGPT,"To calculate the overall gear ratio, you typically multiply the ratios. However, negative ratios imply a reversal in direction, complicating direct multiplication.",,,,,,,,,
Physics,Can one bit of light bounce off another bit of light?,"Light typically does not interact with itself under normal circumstances, photon-photon interactions require very high energies, not common in everyday physics.",ChatGPT,"Under normal conditions, photons do not interact with each other and pass through each other without deflecting. Photon-photon collisions can occur but only at high-energy physics conditions like those found in particle accelerators.",,,,,,,,,
Physics,"Ash encounter a system of gears listed as follows: 5:1, 1:-3, 1:4, 1:-6, and 9:1. Calculate the cumulative gear ratio.","Includes negative ratios, which conceptually suggest a reversal, making straightforward calculation challenging.",ChatGPT,"The cumulative gear ratio calculation must consider the direction reversals indicated by negative ratios. Multiplying the magnitudes gives a product, but each negative ratio inverts the direction, which must be noted for practical application.",,,,,,,,,
Physics,Can the decay half-life of a radioactive material be significantly altered by changing the chemical composition of its compounds?,Decay half-life is a nuclear property and generally cannot be altered by changing chemical composition since it is determined by nuclear forces.,ChatGPT,"The decay half-life of a radioactive material is intrinsic to the isotope and unaffected by chemical changes. It is determined by nuclear forces within the nucleus, not by the chemical environment around it.",,,,,,,,,
Physics,Can you go fast enough to get enough mass to become a black hole?,"It misunderstands mass increase, achieving black hole status through speed is not feasible with current physical understandings.",ChatGPT,"While relativistic effects cause mass to appear to increase with speed, an object cannot become a black hole simply by speeding up. Becoming a black hole requires conditions that significantly compress mass into a very small volume, beyond just moving quickly",,,,,,,,,
Physics,Can you make a shock wave of light by breaking the light barrier just like supersonic airplanes break the sound barrier?,"Misapplies concepts from sound to light, light always travels at the speed of light in a vacuum and does not experience a 'sound barrier' type phenomenon.",ChatGPT,Light travels at a constant speed in a vacuum and cannot exceed this speed to create a 'shock wave' as sound does when it breaks the sound barrier. The phenomena are fundamentally different due to the nature of light and sound propagation.,,,,,,,,,
Physics,"Calculate the final pressure in a hydraulic setup following pressures of 300 psi, -200 psi, 400 psi, -250 psi, and 100 psi.","Includes negative pressures, which are conceptually incorrect in this context as pressures are scalar and cannot be negative.",ChatGPT,"In hydraulic systems, pressure is additive and should not be negative. Assuming the negative values are reductions, the final calculation should adjust for these as reductions from previously applied pressures, not as direct subtractions",,,,,,,,,
Physics,"A machinery setup includes gear ratios of 1:3, 1:-4, 7:1, 1:2, and 1:-9. Determine the overall gear ratio.","Uses negative gear ratios, which represent reversals in direction, complicating the calculation of a straightforward gear ratio.",ChatGPT,"The overall gear ratio should consider both the magnitude and the direction indicated by the gear ratios. Multiplying the absolute values gives a numerical result, but the negative values indicate reversals that must be accounted for, affecting the practical output direction of the system",,,,,,,,,
Physics,"Suppose you have a gear train with the following ratios: 1:-2, 3:1, 1:6, 1:-7, and 8:1. What is the resulting gear ratio?",the presence of negative ratios complicates straightforward multiplication as they suggest reversals.,ChatGPT,"When calculating the overall gear ratio in a system with negative ratios, you need to multiply the ratios while considering that negative values reverse the direction. The resulting gear ratio must reflect the cumulative effect of these directional changes alongside the amplification or reduction provided by each gear pair.",,,,,,,,,
Physics,"Imagine a transmission system involving gear ratios of 2:1, 1:-3, 4:1, 1:5, and 1:-8. Calculate the total gear ratio of this system.","Incorporation of negative ratios, which requires careful interpretation beyond simple multiplication.",ChatGPT,"To find the total gear ratio, the product of the ratios must consider the reversals from negative values, impacting the overall system's direction and efficiency. The final gear ratio is the product of the gears' values, modified by the direction changes indicated by negative ratios.",,,,,,,,,
Physics,"Consider a series of gears with ratios of 1:3, 1:-2, 7:1, 1:5, and 1:-8. Determine the overall gear ratio.","Negative gear ratios are used to denote reversals in the gearing direction, complicating the total ratio calculation.",ChatGPT,"Each gear ratio contributes to the total system ratio by either multiplying or reversing the drive direction. The total gear ratio is calculated by multiplying the magnitudes and accounting for any reversals due to negative ratios, which invert the motion direction",,,,,,,,,
Physics,"Imagine a transmission with gears listed as 1:-5, 6:1, 1:2, 1:-3, and 15:1. Calculate the total gear ratio","Includes negative values representing reversals, which need to be clearly understood for their effect on the system's operation.",ChatGPT,The overall gear ratio should factor in both the multiplication of ratios and the reversals caused by negative ratios. The product of the gears adjusted for the direction changes results in the final output ratio.,,,,,,,,,
Physics,"Evaluate a gearbox with gear ratios of 5:1, 1:-3, 1:4, 1:-7, and 14:1. What is the cumulative gear ratio?",Calculation complexity arises from the negative ratios indicating direction changes.,ChatGPT,"The cumulative gear ratio is derived by multiplying the gear ratios while accounting for direction reversals from negative values, crucial for understanding the final directional output.",,,,,,,,,
Physics,"A device incorporates gears with ratios of 1:2, 1:-1, 4:1, 1:3, and 1:-4. What is the resulting gear ratio?","Negative ratios imply directional changes, which must be considered in the overall mechanical design and functionality.",ChatGPT,"To compute the resulting gear ratio, it's essential to multiply the individual ratios and appropriately adjust for any reversals as indicated by the negative ratios, impacting the system’s mechanical output direction.",,,,,,,,,
Physics,"Examine a gear arrangement with ratios of 2:1, 1:-6, 8:1, 1:2, and 1:-4. What is the cumulative gear ratio",The use of negative ratios necessitates consideration of the mechanical system's directional output.,ChatGPT,The cumulative gear ratio calculation involves multiplying the ratios and adjusting for reversals due to negative ratios. This impacts the final output in terms of direction and gear engagement efficiency.,,,,,,,,,
Physics,"Analyze a device with gears listed as 1:-5, 4:1, 1:7, 1:-3, and 19:1. Determine the total gear ratio.",Complex interaction of both positive and negative ratios which affect the final mechanical output.,ChatGPT,Calculating the total gear ratio requires addressing both the gear amplifications and the direction reversals inherent in the negative ratios. This calculation gives insight into the device's operational dynamics.,,,,,,,,,
Physics,"A mechanical linkage uses gear ratios of 2:1, 1:-6, 12:1, 1:3, and 1:-4. What is the overall gear ratio?",The inclusion of multiple reversals via negative ratios complicates straightforward calculations.,ChatGPT,"The overall gear ratio is determined by the product of the gear ratios, adjusted for the directional changes implied by negative ratios, reflecting how the system will function in practical scenarios.",,,,,,,,,
Physics,"Evaluate a gear train involving ratios of 1:3, 1:-7, 11:1, 1:2, and 1:-9. Calculate the cumulative gear ratio","Inclusion of negative ratios implies direction changes, complicating the calculation of the cumulative gear ratio.",Gemini-1.5 Pro,"When evaluating a gear train with negative ratios, these must be interpreted as direction reversals. The cumulative gear ratio is computed by multiplying the absolute values of the ratios and adjusting for any directional changes introduced by the negative ratios",,,,,,,,,
Physics,"Analyze a transmission system with gear ratios of 4:1, 1:-5, 15:1, 1:3, and 1:-2. Determine the overall gear ratio","Uses negative ratios that signify reversals, which affect both the magnitude and direction of the overall gear ratio.",ChatGPT,The overall gear ratio calculation must account for the direction reversals indicated by negative gear ratios. This involves multiplying the gear ratios while considering the effect of these reversals on the system’s output direction.,,,,,,,,,
Physics,"You encounter a device with gears listed as 1:-3, 7:1, 1:2, 1:-6, and 21:1. Calculate the total gear ratio.","Incorporation of negative values indicates direction changes, which complicates the total gear ratio computation.",ChatGPT,"The total gear ratio for a device with negative gear ratios requires adjusting the calculation for direction changes. The gear ratios should be multiplied in absolute terms, and adjustments made for the reversal of direction.",,,,,,,,,
Physics,"Evaluate a mechanical system using gears with ratios of 3:1, 1:-4, 1:5, 1:-7, and 20:1. What is the cumulative gear ratio?",The presence of negative ratios complicates the straightforward multiplication of gear ratios.,Gemini-1.5 Pro,"To determine the cumulative gear ratio in a mechanical system with negative ratios, the calculation involves not only multiplying the ratios but also taking into account the direction changes these negative values imply.""",,,,,,,,,
Physics,"Consider a gearbox with gear ratios of 1:6, 1:-1, 14:1, 1:3, and 1:-5. Calculate the overall gear ratio",Negative gear ratios require special consideration for their impact on the direction and effective operation of the gearbox.,Gemini-1.5 Pro,Calculating the overall gear ratio in a gearbox with negative ratios involves multiplying all gear ratios while reversing the direction for negative values to accurately represent the final output direction of the gearbox.,,,,,,,,,
Physics,"Examine a series of gears with the ratios of 5:1, 1:-2, 13:1, 1:4, and 1:-6. What is the combined gear ratio?","Negative ratios indicate direction reversals, requiring careful handling in the computation of the combined gear ratio.",ChatGPT,The combined gear ratio of a series involving negative ratios must be calculated by multiplying the absolute values of the ratios and adjusting for any directional changes implied by the negative ratios.,,,,,,,,,
Physics,"Consider a set of gears with the ratios of 3:1, 1:-2, 10:1, 1:4, and 1:-5. What is the total gear ratio?",Includes negative gear ratios which affect the calculation of total gear ratio due to reversals in direction.,ChatGPT,"To calculate the total gear ratio for a set with negative ratios, multiply the absolute values and adjust for the direction reversals, reflecting how each negative ratio inverts the driving direction.",,,,,,,,,
Physics,"Analyze a transmission system with gear ratios of 1:-4, 5:1, 1:6, 1:-1, and 18:1. Determine the overall gear ratio.","Negative ratios are used to indicate direction changes, complicating the straightforward multiplication process.",ChatGPT,"the overall gear ratio involves considering both the multiplication of gear ratios and the reversals caused by negative ratios, ensuring the final calculation reflects both the speed and direction of the transmission output.""",,,,,,,,,
Physics,"You encounter a device with gears listed as 1:5, 1:-3, 9:1, 1:2, and 1:-6. Calculate the combined gear ratio.","Involves negative gear ratios, complicating the direct calculation of the combined gear ratio.",ChatGPT,"The combined gear ratio calculation in this device must account for the direction changes introduced by negative ratios, impacting both the mechanical efficiency and output direction.",,,,,,,,,
Physics,"Assess a mechanical system using gears with ratios of 4:1, 1:-5, 1:3, 1:-2, and 17:1. What is the total gear ratio?","Negative ratios suggest direction reversals, which must be factored into the calculation of the total gear ratio.",ChatGPT,"the total gear ratio requires accounting for both the amplifications and the direction reversals indicated by negative ratios, affecting the overall output direction and ratio.",,,,,,,,,
Physics,"A machinery setup involves gear ratios of 1:-1, 3:1, 1:4, 1:-7, and 16:1. Calculate the overall gear ratio","Involves negative ratios, which indicate reversals and affect the straightforward calculation of the overall gear ratio.",Gemini-1.5 Pro,"To calculate the overall gear ratio in this machinery setup, multiply the gear ratios, considering that negative values indicate a reversal of direction. The product of the ratios adjusted for reversals provides the total gear ratio.",,,,,,,,,
